{
  "caption": "Behavior Analysis",
  "description": "",
  "extends": "object", 
  "name": "behavior_analysis",
  "attributes": {
    "baselines": {
      "description": "",
      "requirement": "recommended"
    },
    "anomalies": {
      "description": "",
      "requirement": "required"
    },
    "dimension": {
      "description": "The specific dimension, component, or aspect of the system that is the target of the analysis.",
      "requirement": "required"
    }
  }
}
