{
  "caption": "Base Event",
  "description": "The base event is a generic concrete event and it also defines a set of attributes available in most event classes. As a generic event that does not belong to any event category, it could be used to log events that are not otherwise defined by the schema.",
  "name": "base_event",
  "extends": "base_event",
  "attributes": {
    "record_id": {
      "description": "Unique idenifier for the event",
      "group": "primary",
      "requirement": "required"
    }
  }
}
