{
  "caption": "AI Operation",
  "description": "AI-specific attributes for model operations, retrieval systems, and agent activities. e.g. model_name, total_token_counts etc.",
  "meta": "profile",
  "name": "ai_operation",
  "attributes": {
    "ai_agent": {
      "description": "The autonomous AI agent that performed this operation. Carries model identity via <code>ai_agent.ai_model</code>. Populate when the action was performed by an agent rather than a direct model call.",
      "group": "context",
      "requirement": "optional"
    },
    "ai_capability": {
      "description": "The AI capability invoked in this operation: a tool, resource, or prompt, in the sense of the MCP primitives. Records the capability's identity, kind, provenance, declared contracts, and declared safety hints. Transport details remain on the event's transport attributes (e.g., <code>api</code>, <code>http_request</code>), and affected objects remain in <code>resources</code>. Producers deriving <code>activity_id</code> from the capability's declared hints (e.g., mapping a declared read-only tool to <code>Read</code>) should note the hints are self-declared and unverified; when the observed operation contradicts the declaration, classify by observed behavior.",
      "group": "context",
      "requirement": "optional"
    },
    "ai_model": {
      "description": "The AI model involved in this operation. Use for direct model invocations where no autonomous agent is involved. For agent-mediated operations, model identity is carried within <code>ai_agent.ai_model</code> instead.",
      "group": "context",
      "requirement": "recommended"
    },
    "delegation": {
      "description": "The delegation under whose authority this AI operation was performed. Links the event to a durable authorization context independent of traces and sessions, enabling correlation of all events executed under the same delegated authority.",
      "group": "context",
      "requirement": "optional"
    },
    "message_context": {
      "group": "context",
      "requirement": "optional"
    },
    "containment_reason": {
      "caption": "Containment Reason",
      "description": "The reason enforcement acted on this operation, as reported by the event source — e.g. an operator kill, a guardrail kill, or a crash. Normalized to the caption of <code>containment_reason_id</code>; when the value is 'Other', this carries the event source's native label. Distinct from why a model completion ended (carried in <code>ai_status.stop_reason</code>): this records why enforcement acted, so an operator kill, a guardrail kill, and a crash are distinguishable and time-to-contain is measurable across deployments.",
      "group": "context",
      "requirement": "optional"
    },
    "containment_reason_id": {
      "caption": "Containment Reason ID",
      "description": "The normalized reason enforcement acted on this operation. Producers map their runtime's native value into this set; when the value is 'Other', set <code>containment_reason</code> to the event source's native label.",
      "group": "context",
      "requirement": "optional"
    }
  }
}
