{
  "caption": "Network Connection Information",
  "name": "network_connection_info",
  "description": "The network connection information object.",
  "extends": "object",
  "attributes": {
    "boundary": {},
    "boundary_id": {},
    "direction": {
      "description": "The direction of the initiated connection.",
      "requirement": "optional"
    },
    "direction_id": {
      "description": "The direction of the initiated connection.",
      "enum": {
        "0": {
          "description": "Connection direction is unknown.",
          "caption": "Unknown"
        },
        "1": {
          "description": "Inbound network connection. The connection was originated from the Internet or outside network, destined for services on the inside network.",
          "caption": "Inbound"
        },
        "2": {
          "description": "Outbound network connection. The connection was originated from inside the network, destined for services on the Internet or outside network.",
          "caption": "Outbound"
        },
        "3": {
          "description": "Lateral network connection. The connection was originated from inside the network, destined for services on the inside network.",
          "caption": "Lateral"
        },
        "99": {
          "caption": "Other"
        }
      },
      "requirement": "required"
    },
    "protocol_name": {},
    "protocol_num": {
      "requirement": "recommended"
    },
    "protocol_ver": {
      "description": "The Internet Protocol version.",
      "caption": "IP Version"
    },
    "protocol_ver_id": {
      "description": "The Internet Protocol version identifier.",
      "enum": {
        "0": {
          "caption": "Unknown"
        },
        "4": {
          "caption": "Internet Protocol version 4 (IPv4)"
        },
        "6": {
          "caption": "Internet Protocol version 6 (IPv6)"
        },
        "99": {
          "caption": "Other"
        }
      },
      "caption": "IP Version ID"
    },
    "tcp_flags": {},
    "uid": {
      "description": "The unique identifier of the connection.",
      "caption": "Connection UID"
    }
  }
}
