{
  "caption": "Previous Event",
  "description": "The Previous Event object references the previous event in a chain of events. Refer to specific usage.",
  "extends": "object",
  "name": "prev_event",
  "attributes": {
    "fingerprint": {
      "caption": "Fingerprint",
      "description": "The fingerprint of the previous event, binding this reference to the previous event's content so that altering or substituting the previous event breaks the link. Refer to specific usage.",
      "requirement": "optional"
    },
    "type_uid": {
      "caption": "Type ID",
      "description": "The event type identifier of the previous event, as carried in that event's <code>type_uid</code>. It directs a consumer to the event class, and therefore the table or store, where the previous event resides.",
      "requirement": "recommended"
    },
    "uid": {
      "caption": "Unique ID",
      "description": "The unique identifier of the previous event, as carried in that event's <code>metadata.uid</code>.",
      "requirement": "required"
    }
  }
}