{
  "caption": "Record Integrity",
  "description": "The Record Integrity profile adds a cryptographic attestation over the event itself, providing integrity, authenticity, and non-repudiation independent of any domain-specific content. It is domain-agnostic and may be applied to any event class. The attestation is computed over a canonical serialization of the event; multiple signers, such as a producer plus a co-signature, notary, or witness over the same event, are carried in the attestation's <code>signatures</code> array, and a sequence of events may form a tamper-evident hash chain.",
  "meta": "profile",
  "name": "record_integrity",
  "attributes": {
    "attestation": {
      "group": "context",
      "requirement": "optional"
    }
  }
}
