{
  "caption": "Authentication Ticket",
  "description": "The Authentication Ticket object contains the attributes pertaining to a Authentication ticket.",
  "extends": "object",
  "name": "auth_ticket",
  "attributes": {
    "created_time": {
      "description": "The time that the Authentication ticket was created.",
      "requirement": "optional"
    },
    "encryption_details": {
      "description": "The encryption details of the Authentication ticket.",
      "requirement": "optional"
    },
    "expiration_time": {
      "description": "The expiration time of the Authentication ticket.",
      "requirement": "optional"
    },
    "is_renewable": {
      "description": "Indicates whether the Authentication ticket is renewable.",
      "requirement": "optional"
    },
    "properties": {
      "description": "The properties of the Authentication ticket.",
      "requirement": "optional"
    },
    "ticket_flags": {
      "description": "The specific attributes or permissions for the Authentication ticket, such as whether it is renewable or forwardable",
      "requirement": "optional"
    },
    "type": {
      "description": "The type of the Authentication ticket.",
      "requirement": "recommended"
    },
    "type_id": {
      "caption": "Type ID",
      "description": "The normalized Authentication ticket type identifier.",
      "enum": {
        "0": {
          "caption": "Unknown",
          "description": "The Authentication ticket type is unknown."
        },
        "1": {
          "caption": "Ticket Granting Ticket (TGT)",
          "description": "Ticket Granting Ticket for Kerberos."
        },
        "2": {
          "caption": "Service Ticket (ST)",
          "description": "Service Ticket for Kerberos."
        },
        "3": {
          "caption": "Access Token",
          "description": "Access Token for OAuth."
        },
        "4": {
          "caption": "Refresh Token",
          "description": "Refresh Token for OAuth."
        },
        "5": {
          "caption": "SAML Assertion",
          "description": "SAML Assertion for SAML."
        },
        "99": {
          "caption": "Other"
        }
      },
      "requirement": "recommended"
    }
  }
}