{
  "description": "The attributes that describe information specific to virtual machines.",
  "meta": "profile",
  "caption": "Virtual Machine",
  "name": "virtual_machine",
  "annotations": {
    "group": "compute"
  },
  "attributes": {
    "vm_name": {
      "requirement": "required",
      "description": "The name of the virtual machine."
    },
    "vm_operating_system": {
      "requirement": "required",
      "description": "The operating system running on the virtual machine."
    },
    "vm_cpu_cores": {
      "requirement": "recommended",
      "description": "The number of CPU cores allocated to the virtual machine."
    },
    "vm_memory": {
      "requirement": "recommended",
      "description": "The amount of memory allocated to the virtual machine in bytes or a human-readable format."
    },
    "vm_disk_size": {
      "requirement": "recommended",
      "description": "The size of the virtual machine's disk in bytes or a human-readable format."
    },
    "vm_network_interface": {
      "requirement": "optional",
      "description": "The network interface configuration of the virtual machine."
    },
    "vm_availability_zone": {
      "requirement": "optional",
      "description": "The availability zone in which the virtual machine is deployed."
    },
    "vm_tags": {
      "requirement": "optional",
      "description": "A set of tags or labels associated with the virtual machine for categorization and management purposes."
    }
  }
}
