{
  "caption": "Malware Scan Details",
  "description": "The Malware scan object describes characteristics of a scan job.",
  "extends": "scan",
  "name": "malware_scan",
  "attributes": {
    "end_time": {
      "description": "The timestamp of when the scan job was completed.",
      "requirement": "optional"
    },
    "num_files": {
      "description": "The number of files scanned.",
      "requirement": "optional"
    },
    "num_volumes": {
      "description": "The number of volumes that were scanned during the malware scan job.",
      "requirement": "optional"
    },
    "size": {
      "description": "The total size of all files that were scanned.",
      "requirement": "optional"
    },
    "start_time": {
      "description": "The timestamp of when the scan job was started.",
      "requirement": "optional"
    }
  }
}