{
  "caption": "Vendor Attributes",
  "description": "The Vendor Attributes object can be used to represent values of attributes populated by the Vendor/Finding Provider. It can help distinguish between the vendor-prodvided values and consumer-updated values, of key attributes like <code>severity_id</code>.<br>The original finding producer should not populate this object. It should be populated by consuming systems that support data mutability.",
  "extends": "object",
  "name": "vendor_attributes",
  "attributes": {
    "severity": {
      "description": "The finding severity, as reported by the Vendor (Finding Provider). The value should be normalized to the caption of the <code>severity_id</code> value. In the case of 'Other', it is defined by the source.",
      "requirement": "optional"
    },
    "severity_id": {
      "description": "The finding severity ID, as reported by the Vendor (Finding Provider).",
      "requirement": "optional"
    }
  }
}

