{
  "caption": "Subject Alternative Name",
  "name": "san",
  "extends": "object",
  "description": "Subject Alternative name (SAN) secured by a digital certificate",
  "attributes": {
    "name": {
      "description": "Name of SAN (e.g. The actual IP Address or domain.)",
      "requirement": "required"
    },
    "type": {
      "description": "Type descriptor of SAN (e.g. IP Address/domain/etc.)",
      "requirement": "required"
    }
  }
}
