{
  "description": "The object conveys the reputation/risk score of an entity (e.g. device, user, domain).",
  "caption": "Reputation",
  "name": "reputation",
  "extends": "object",
  "attributes": {
    "base_score": {
      "caption": "Reputation Score",
      "description": "The reputation score as reported by the event source.",
      "requirement": "required"
    },
    "provider": {
      "description": "The provider of the reputation information.",
      "requirement": "recommended"
    },
    "score": {
      "requirement": "optional"
    },
    "score_id": {
      "requirement": "required"
    }
  }
}