{
  "caption": "Clipboard",
  "description": "The Clipboard object represents the an endpoint clipboard and its contents.",
  "extends": "object",
  "name": "clipboard",
  "attributes": {
    "contents": {
      "description": "The data items written to, or read from, the clipboard.",
      "requirement": "recommended"
    },
    "name": {
      "description": "The name of the clipboard on systems with named clipboards. For example: <code>General</code> or <code>Drag</code>.",
      "requirement": "optional"
    }
  }
}



