{
  "caption": "Product",
  "description": "The Product object describes characteristics of a software product.",
  "extends": "_entity",
  "name": "product",
  "attributes": {
    "cpe_name": {
      "requirement": "optional"
    },
    "data_classifications": {
      "group": "context",
      "requirement": "recommended"
    },
    "feature": {
      "requirement": "optional"
    },
    "lang": {
      "requirement": "optional"
    },
    "name": {
      "description": "The name of the product."
    },
    "path": {
      "description": "The installation path of the product.",
      "requirement": "optional"
    },
    "uid": {
      "description": "The unique identifier of the product."
    },
    "url_string": {
      "description": "The URL pointing towards the product.",
      "requirement": "optional"
    },
    "vendor_name": {
      "description": "The name of the vendor of the product.",
      "requirement": "recommended"
    },
    "version": {
      "description": "The version of the product, as defined by the event source. For example: <code>2013.1.3-beta</code>.",
      "requirement": "recommended"
    }
  }
}